{
  "name": "graphite",
  "schemaVersion": 1,
  "extends": "dark",
  "variant": "dark",
  "window": {
    "translucent": true,
    "backdrop": "blur",
    "backgroundOpacity": 0.8
  },
  "palette": {
    "appBackground": "#161618",
    "panelBackground": "#f0202022",
    "panelBorder": "#1affffff",
    "border": "#2e2e30",
    "foreground": "#ececec",
    "panelForeground": "#e4e4e4",
    "mutedForeground": "#8e8e93",
    "primary": "#f2f2f2",
    "primaryForeground": "#111111",
    "accentOnPanel": "#e6e6e6",
    "accent": "#2a2a2c",
    "accentForeground": "#f2f2f2",
    "panelAccent": "#1fffffff",
    "panelAccentForeground": "#f5f5f5",
    "panelMuted": "#3a3a3c",
    "popoverHover": "#1affffff",
    "panelSecondaryBg": "#2a2a2c",
    "panelSecondaryBorder": "#4a4a4c",
    "panelSecondaryForeground": "#f0f0f0",
    "exportGradientTop": "#f5f5f5",
    "exportGradientBottom": "#c8c8c8",
    "exportGlow": "#ffffff",
    "scrollbarTrack": "#1a000000",
    "scrollbarHandle": "#5a5a5e",
    "scrollbarHandleHover": "#78787c",
    "scrollbarHandlePressed": "#a8a8ac",
    "sheetHandle": "#5a5a5e",
    "sliderTrack": "#48484a",
    "snapGuide": "#e0e0e0",
    "skeleton": "#2a2a2c",
    "skeletonHighlight": "#363638",
    "textStylePreviewBg": "#1e1e20",
    "textStylePreviewBorder": "#3a3a3c",
    "clipVideoPlaceholder": "#2c2c2e",
    "previewLetterbox": "#121214"
  },
  "components": {
    "panelFrame": {
      "background": "#00000000"
    },
    "previewPanel": {
      "background": "#00000000"
    },
    "propertiesPanel": {
      "background": "#00000000"
    },
    "assetsPanel": {
      "background": "#00000000"
    },
    "assetsPanelHeader": {
      "background": "#00000000"
    },
    "timelinePanel": {
      "background": "#00000000"
    },
    "timelineToolbar": {
      "background": "#00000000"
    }
  }
}
